{
  "schema": 1,
  "skillCount": 20,
  "fileCount": 42,
  "files": [
    {
      "path": "skills/ci-cd-and-automation/SKILL.md",
      "sha256": "7aa008e4be26068c9e61ea8a9303711020e376c6cbfdf10d581a9fd400acf8ea",
      "size": 11470
    },
    {
      "path": "skills/deprecation-and-migration/SKILL.md",
      "sha256": "52ef07de05726292c0f5e9fe666cc30e6efbe580ed775621e785a49ec80bd4ea",
      "size": 12510
    },
    {
      "path": "skills/diagnose/SKILL.md",
      "sha256": "28886402bbfa0470248086eab9106a103b964b76ae9496e63ff0c8a6761b6d13",
      "size": 7163
    },
    {
      "path": "skills/diagnose/scripts/hitl-loop.template.sh",
      "sha256": "26b45e7b0893de95d8a74da6d36a512682313d1f018cf82549a67f4aa59468c3",
      "size": 1165
    },
    {
      "path": "skills/git-guardrails/SKILL.md",
      "sha256": "27bb96dda0850f3d969b550ff01f996d22cf53ef1ef4d1bc678b18a82f66d790",
      "size": 4002
    },
    {
      "path": "skills/git-guardrails/scripts/block-dangerous-git.sh",
      "sha256": "9acf0e890ecc535358f45fc15cec867b2eb6a78f4089dfd3777c388c81d3564a",
      "size": 508
    },
    {
      "path": "skills/grill-with-docs/ADR-FORMAT.md",
      "sha256": "a03e3fd7d41ec592f5a7dea1259db10d3b69cc9e11a1a008fdd928f6ba72cb6b",
      "size": 2767
    },
    {
      "path": "skills/grill-with-docs/CONTEXT-FORMAT.md",
      "sha256": "1258dc5758382ceb6a6e4ab737548f21ec1c931d7697b0bcdba1f0abfe5f3677",
      "size": 2300
    },
    {
      "path": "skills/grill-with-docs/SKILL.md",
      "sha256": "e1078020c41b954638ba94acda95a3340739908bd68b1db9bc2af129d3936035",
      "size": 5340
    },
    {
      "path": "skills/handoff/SKILL.md",
      "sha256": "d215dd8f2a19bf85fdaf67a3cdb5077641f6b4108f229ba79579414793d7b0a3",
      "size": 847
    },
    {
      "path": "skills/improve-codebase-architecture/DEEPENING.md",
      "sha256": "d158efea1916729346e5d8a6bfddce7687570187d03327459977fa55955ba693",
      "size": 2566
    },
    {
      "path": "skills/improve-codebase-architecture/HTML-REPORT.md",
      "sha256": "2f53d996dca42ad7a7570373a27249a286dd91c1c8ccc073f96249c86879fb22",
      "size": 6672
    },
    {
      "path": "skills/improve-codebase-architecture/INTERFACE-DESIGN.md",
      "sha256": "dbfda2a62ba9acc65a098a95422c96c5368fc1cef5448f5377bac36c733e8040",
      "size": 2726
    },
    {
      "path": "skills/improve-codebase-architecture/LANGUAGE.md",
      "sha256": "db84d1a48f59b8153e4a30568257f7200e99db8fe487262f166bd297fc95bd3e",
      "size": 3805
    },
    {
      "path": "skills/improve-codebase-architecture/SKILL.md",
      "sha256": "f00de04c7bb83cfd0ed1f97f3401a83838212c30856912ee44ba406649e6c749",
      "size": 6518
    },
    {
      "path": "skills/migrate-to-shoehorn/SKILL.md",
      "sha256": "1d5d79ae3f21220553da1f9fd438799f27f6fcb5b16c61c87ceee4aa2d3f4d61",
      "size": 3377
    },
    {
      "path": "skills/observability-and-instrumentation/SKILL.md",
      "sha256": "4ff6d4d23e5b41db29e9b4e289e033ccc1281b986053ca45e83b889955395aa0",
      "size": 11761
    },
    {
      "path": "skills/obsidian-open-format-knowledge-files/SKILL.md",
      "sha256": "de8884f63cb9809531999d0f3cdc2fabbbe5a8963717e0fe0ea8a3ce3db4d75b",
      "size": 4394
    },
    {
      "path": "skills/performance-optimization/SKILL.md",
      "sha256": "7faa154ece0c18f4682626016565e4b428b00cebce233b3aa91242126bcc76d2",
      "size": 13282
    },
    {
      "path": "skills/prototype/LOGIC.md",
      "sha256": "cc372cb25ec9aebcb4c1a03bc2582022d98c13d2a57c10a02c178bd4e4295874",
      "size": 5595
    },
    {
      "path": "skills/prototype/SKILL.md",
      "sha256": "1360c65d942cacd5a06e99424fb7f4e5606227c3a1bd020e2427c35356e6aba0",
      "size": 3965
    },
    {
      "path": "skills/prototype/UI.md",
      "sha256": "4534cad20fe2843edb0da44c7014bb23b06ac15089886971d95a4549a739f458",
      "size": 6790
    },
    {
      "path": "skills/review/SKILL.md",
      "sha256": "7d20260e46399ca040ee53bee5fbe057fffd7fec0866bc7a627c4f422c69a0e6",
      "size": 6406
    },
    {
      "path": "skills/setup-project-skills/SKILL.md",
      "sha256": "ebee5596b95a77f7780c4f8df591612f82b4c2a59ed47b72b115f659fa9af604",
      "size": 7128
    },
    {
      "path": "skills/setup-project-skills/domain.md",
      "sha256": "968afe4b216eac21a647caa79fa1cffaedeb41e8eb2adf2da20b0ed36a645d3e",
      "size": 1987
    },
    {
      "path": "skills/setup-project-skills/issue-tracker-github.md",
      "sha256": "30acc5b79622b26e4f1940f471ce1b335d2e6ed57e32c95d8b54f710ac01e1f6",
      "size": 1066
    },
    {
      "path": "skills/setup-project-skills/issue-tracker-gitlab.md",
      "sha256": "9e2a5aa71be68e7333ff3019761fc3f786f46a9be59f03c451fb9f4112bd7dfd",
      "size": 1466
    },
    {
      "path": "skills/setup-project-skills/issue-tracker-local.md",
      "sha256": "80d1cf98c31fb329023fa2a3a0f6c307651173ffa95d02e2e0454d999bc274d9",
      "size": 839
    },
    {
      "path": "skills/setup-project-skills/triage-labels.md",
      "sha256": "e8ad29022aecc56994d0e670bbb0a4a7b86c817ffe4dcbd875764b8713071860",
      "size": 1046
    },
    {
      "path": "skills/shipping-and-launch/SKILL.md",
      "sha256": "195a1fad5612627464df4581954727b8ebd649b0ce4bfe91e06655bcc32302b0",
      "size": 11464
    },
    {
      "path": "skills/tdd/SKILL.md",
      "sha256": "af059705061156fd4845ddbb736fe92b564118ac5f03551e09ef9e8f6d970638",
      "size": 4395
    },
    {
      "path": "skills/tdd/deep-modules.md",
      "sha256": "c9a660b2517b3ebd523740ee015a88045cf14d117c9f7dd366544f2c44a6abd4",
      "size": 1240
    },
    {
      "path": "skills/tdd/interface-design.md",
      "sha256": "d7f692a73542d623ce7626214c43b68d02fa6fb504ebb9f81fddc29e9a2e47b9",
      "size": 654
    },
    {
      "path": "skills/tdd/mocking.md",
      "sha256": "a18776a6e360a8bf147baaed3c3fcc6d656a7e73d03176d5a5de458ae62c8f70",
      "size": 1482
    },
    {
      "path": "skills/tdd/refactoring.md",
      "sha256": "39f8ca714bb396dc46b0115d3a0b554eef758dd6cf6d29eda48e90260116daad",
      "size": 388
    },
    {
      "path": "skills/tdd/tests.md",
      "sha256": "8f90b3785ae43599bf5723a2c8b262cd87b3ec613298cb172614c14394501e97",
      "size": 1641
    },
    {
      "path": "skills/to-issues/SKILL.md",
      "sha256": "0cd6731492568bee3e1996133c4c08abf7aafdb089bc2336b04d059dc9feee95",
      "size": 4082
    },
    {
      "path": "skills/to-prd/SKILL.md",
      "sha256": "7cdbf633a0caf42d7c833080b3b8da075257b22758eeb47889c0fc985c04e7c9",
      "size": 3643
    },
    {
      "path": "skills/triage/AGENT-BRIEF.md",
      "sha256": "511cbc0b8509b021380b45199c190e835c8bf7be0b82cbddfe6cee67c496ba15",
      "size": 6244
    },
    {
      "path": "skills/triage/OUT-OF-SCOPE.md",
      "sha256": "284b464f3e186749db0bba5a196b1c8511982ddbe9462524b7d64deb29b8fcdb",
      "size": 4283
    },
    {
      "path": "skills/triage/SKILL.md",
      "sha256": "915ebd87113655b826aa477c67987ab9c5ffde281d694272a598d8c61455de88",
      "size": 5329
    },
    {
      "path": "skills/ubiquitous-language/SKILL.md",
      "sha256": "2449e2345b96b9f1e861c697b5eab50d03ae1254481a4306b6f815684e523b3a",
      "size": 4890
    }
  ]
}
